[
  {
    "currentSimTime": 1845,
    "activeTimelines": [
      {
        "timelineType": "Wisp",
        "timelineID": 4,
        "actions": [
          {
            "actionType": "WorkerMovementAction",
            "trigger": {
              "triggerType": "ASAP"
            },
            "actionID": 0,
            "travelTime": 10,
            "startTime": 0,
            "requiredTimelineType": "Wisp",
            "currentWorkerTask": "IDLE",
            "desiredWorkerTask": "GOLD",
            "workerTimelineID": null
          }
        ]
      },
      {
        "timelineType": "Wisp",
        "timelineID": 5,
        "actions": [
          {
            "actionType": "WorkerMovementAction",
            "trigger": {
              "triggerType": "ASAP"
            },
            "actionID": 1,
            "travelTime": 12.0,
            "startTime": 0,
            "requiredTimelineType": "Wisp",
            "currentWorkerTask": "IDLE",
            "desiredWorkerTask": "GOLD",
            "workerTimelineID": null
          }
        ]
      },
      {
        "timelineType": "Wisp",
        "timelineID": 6,
        "actions": [
          {
            "actionType": "WorkerMovementAction",
            "trigger": {
              "triggerType": "ASAP"
            },
            "actionID": 2,
            "travelTime": 15.0,
            "startTime": 0,
            "requiredTimelineType": "Wisp",
            "currentWorkerTask": "IDLE",
            "desiredWorkerTask": "GOLD",
            "workerTimelineID": null
          }
        ]
      },
      {
        "timelineType": "Wisp",
        "timelineID": 7,
        "actions": [
          {
            "actionType": "WorkerMovementAction",
            "trigger": {
              "triggerType": "ASAP"
            },
            "actionID": 3,
            "travelTime": 18.0,
            "startTime": 0,
            "requiredTimelineType": "Wisp",
            "currentWorkerTask": "IDLE",
            "desiredWorkerTask": "GOLD",
            "workerTimelineID": null
          }
        ]
      },
      {
        "timelineType": "Tree of Life",
        "timelineID": 9,
        "actions": [
          {
            "actionType": "BuildUnitAction",
            "trigger": {
              "triggerType": "ASAP"
            },
            "actionID": 4,
            "name": "Wisp",
            "duration": 140,
            "goldCost": 60,
            "lumberCost": 0,
            "startTime": 0,
            "requiredTimelineType": "Tree of Life",
            "foodCost": 1
          },
          {
            "actionType": "BuildUnitAction",
            "trigger": {
              "triggerType": "ASAP"
            },
            "actionID": 7,
            "name": "Wisp",
            "duration": 140,
            "goldCost": 60,
            "lumberCost": 0,
            "startTime": 140,
            "requiredTimelineType": "Tree of Life",
            "foodCost": 1
          },
          {
            "actionType": "BuildUnitAction",
            "trigger": {
              "triggerType": "ASAP"
            },
            "actionID": 9,
            "name": "Wisp",
            "duration": 140,
            "goldCost": 60,
            "lumberCost": 0,
            "startTime": 280,
            "requiredTimelineType": "Tree of Life",
            "foodCost": 1
          },
          {
            "actionType": "BuildUnitAction",
            "trigger": {
              "triggerType": "ASAP"
            },
            "actionID": 11,
            "name": "Wisp",
            "duration": 140,
            "goldCost": 60,
            "lumberCost": 0,
            "startTime": 420,
            "requiredTimelineType": "Tree of Life",
            "foodCost": 1
          },
          {
            "actionType": "BuildUnitAction",
            "trigger": {
              "triggerType": "ASAP"
            },
            "actionID": 13,
            "name": "Wisp",
            "duration": 140,
            "goldCost": 60,
            "lumberCost": 0,
            "startTime": 560,
            "requiredTimelineType": "Tree of Life",
            "foodCost": 1
          },
          {
            "actionType": "BuildUnitAction",
            "trigger": {
              "triggerType": "ASAP"
            },
            "actionID": 17,
            "name": "Wisp",
            "duration": 140,
            "goldCost": 60,
            "lumberCost": 0,
            "startTime": 700,
            "requiredTimelineType": "Tree of Life",
            "foodCost": 1
          },
          {
            "actionType": "BuildUnitAction",
            "trigger": {
              "triggerType": "ASAP"
            },
            "actionID": 19,
            "name": "Wisp",
            "duration": 140,
            "goldCost": 60,
            "lumberCost": 0,
            "startTime": 840,
            "requiredTimelineType": "Tree of Life",
            "foodCost": 1
          },
          {
            "actionType": "BuildUnitAction",
            "trigger": {
              "triggerType": "ASAP"
            },
            "actionID": 23,
            "name": "Wisp",
            "duration": 140,
            "goldCost": 60,
            "lumberCost": 0,
            "startTime": 980,
            "requiredTimelineType": "Tree of Life",
            "foodCost": 1
          },
          {
            "actionType": "BuildUnitAction",
            "trigger": {
              "triggerType": "ASAP"
            },
            "actionID": 25,
            "name": "Wisp",
            "duration": 140,
            "goldCost": 60,
            "lumberCost": 0,
            "startTime": 1120,
            "requiredTimelineType": "Tree of Life",
            "foodCost": 1
          }
        ]
      },
      {
        "timelineType": "Wisp",
        "timelineID": 8,
        "actions": [
          {
            "actionType": "BuildStructureAction",
            "trigger": {
              "triggerType": "ASAP"
            },
            "actionID": 5,
            "name": "Altar of Elders",
            "duration": 600,
            "travelTime": 80,
            "goldCost": 180,
            "lumberCost": 50,
            "startTime": 0,
            "requiredTimelineType": "Wisp",
            "currentWorkerTask": "IDLE",
            "foodProvided": 0,
            "consumesWorker": false
          },
          {
            "actionType": "WorkerMovementAction",
            "trigger": {
              "triggerType": "PERCENT_OF_ONGOING_ACTION",
              "value": 100,
              "actionID": 5
            },
            "actionID": 15,
            "travelTime": 20,
            "startTime": 680,
            "requiredTimelineType": "Wisp",
            "currentWorkerTask": "IDLE",
            "desiredWorkerTask": "LUMBER",
            "workerTimelineID": null
          },
          {
            "actionType": "BuildStructureAction",
            "trigger": {
              "triggerType": "LUMBER_AMOUNT",
              "value": 150
            },
            "actionID": 20,
            "name": "Hunter's Hall",
            "duration": 600,
            "travelTime": 20,
            "goldCost": 210,
            "lumberCost": 100,
            "startTime": 925,
            "requiredTimelineType": "Wisp",
            "currentWorkerTask": "LUMBER",
            "foodProvided": 0,
            "consumesWorker": false
          }
        ]
      },
      {
        "timelineType": "Wisp",
        "timelineID": 10,
        "actions": [
          {
            "actionType": "BuildStructureAction",
            "trigger": {
              "triggerType": "NEXT_WORKER_BUILT",
              "value": "Wisp"
            },
            "actionID": 6,
            "name": "Moon Well",
            "duration": 500,
            "travelTime": 20,
            "goldCost": 180,
            "lumberCost": 40,
            "startTime": 140,
            "requiredTimelineType": "Wisp",
            "currentWorkerTask": "IN_PRODUCTION",
            "foodProvided": 10,
            "consumesWorker": false
          },
          {
            "actionType": "WorkerMovementAction",
            "trigger": {
              "triggerType": "PERCENT_OF_ONGOING_ACTION",
              "value": 100,
              "actionID": 6
            },
            "actionID": 14,
            "travelTime": 20,
            "startTime": 660,
            "requiredTimelineType": "Wisp",
            "currentWorkerTask": "IDLE",
            "desiredWorkerTask": "LUMBER",
            "workerTimelineID": null
          },
          {
            "actionType": "BuildStructureAction",
            "trigger": {
              "triggerType": "LUMBER_AMOUNT",
              "value": 150
            },
            "actionID": 21,
            "name": "Ancient of War",
            "duration": 600,
            "travelTime": 20,
            "goldCost": 150,
            "lumberCost": 60,
            "startTime": 925,
            "requiredTimelineType": "Wisp",
            "currentWorkerTask": "LUMBER",
            "foodProvided": 0,
            "consumesWorker": true
          }
        ]
      },
      {
        "timelineType": "Wisp",
        "timelineID": 13,
        "actions": [
          {
            "actionType": "WorkerMovementAction",
            "trigger": {
              "triggerType": "NEXT_WORKER_BUILT",
              "value": "Wisp"
            },
            "actionID": 8,
            "travelTime": 15,
            "startTime": 280,
            "requiredTimelineType": "Wisp",
            "currentWorkerTask": "IN_PRODUCTION",
            "desiredWorkerTask": "GOLD",
            "workerTimelineID": null
          }